{
  "schema_version": 1,
  "transcript_id": "punctuation",
  "revision": 3,
  "status": "complete",
  "created_at": "2026-09-03T12:10:00Z",
  "source": { "filename": "punctuation.flac", "duration_ms": 18000, "checksum": "sha256:punctuation" },
  "language": "en",
  "language_source": "detected",
  "timestamp_unit": "milliseconds",
  "timestamp_origin": "source_start",
  "speakers": [{ "id": "speaker_1", "profile_id": "profile-dana", "identity_assignment": "manual", "label_snapshot": "Dana O'Neill" }, { "id": "speaker_2", "profile_id": null, "identity_assignment": "unmatched", "label_snapshot": "Speaker 2" }],
  "segments": [{ "id": "segment_001", "speaker_id": "speaker_1", "speaker_label": "Dana O'Neill", "start_ms": 750, "end_ms": 6250, "text": "\"Ship it,\" she said — then paused... didn't she?", "overlap": false, "timing_quality": "asr_word", "speaker_confidence": 0.5 }, { "id": "segment_002", "speaker_id": "speaker_2", "speaker_label": "Speaker 2", "start_ms": 6500, "end_ms": 12000, "text": "Log path: C:\\logs\\run-01 (50% done); check <staging> & retry!", "overlap": false, "timing_quality": "asr_word", "speaker_confidence": null }],
  "processing_options": { "punctuation": true, "maximum_segment_ms": 30000, "profanity_filter": false },
  "engine_revisions": { "asr": "parakeet-v1", "punctuation": "punct-v2" },
  "warnings": []
}
