{
  "schema_version": 1,
  "transcript_id": "split-long-turn",
  "revision": 1,
  "status": "complete",
  "created_at": "2026-09-03T12:11:00Z",
  "source": {
    "filename": "walkthrough.flac",
    "duration_ms": 40000,
    "checksum": "sha256:split"
  },
  "language": "en",
  "language_source": "detected",
  "timestamp_unit": "milliseconds",
  "timestamp_origin": "source_start",
  "speakers": [
    {
      "id": "speaker_1",
      "profile_id": "profile-priya",
      "identity_assignment": "manual",
      "label_snapshot": "Priya Raman"
    },
    {
      "id": "speaker_2",
      "profile_id": null,
      "identity_assignment": "unmatched",
      "label_snapshot": "Speaker 2"
    }
  ],
  "segments": [
    {
      "id": "segment_001",
      "speaker_id": "speaker_1",
      "speaker_label": "Priya Raman",
      "start_ms": 2000,
      "end_ms": 16950,
      "text": "Today we are going to walk through the entire deployment checklist from start to finish, and I want everyone to follow along in their own terminal so nothing is missed.",
      "overlap": false,
      "timing_quality": "asr_word",
      "speaker_confidence": 0.94,
      "words": [
        {
          "text": "Today",
          "start_ms": 2000,
          "end_ms": 2450
        },
        {
          "text": "we",
          "start_ms": 2500,
          "end_ms": 2950
        },
        {
          "text": "are",
          "start_ms": 3000,
          "end_ms": 3450
        },
        {
          "text": "going",
          "start_ms": 3500,
          "end_ms": 3950
        },
        {
          "text": "to",
          "start_ms": 4000,
          "end_ms": 4450
        },
        {
          "text": "walk",
          "start_ms": 4500,
          "end_ms": 4950
        },
        {
          "text": "through",
          "start_ms": 5000,
          "end_ms": 5450
        },
        {
          "text": "the",
          "start_ms": 5500,
          "end_ms": 5950
        },
        {
          "text": "entire",
          "start_ms": 6000,
          "end_ms": 6450
        },
        {
          "text": "deployment",
          "start_ms": 6500,
          "end_ms": 6950
        },
        {
          "text": "checklist",
          "start_ms": 7000,
          "end_ms": 7450
        },
        {
          "text": "from",
          "start_ms": 7500,
          "end_ms": 7950
        },
        {
          "text": "start",
          "start_ms": 8000,
          "end_ms": 8450
        },
        {
          "text": "to",
          "start_ms": 8500,
          "end_ms": 8950
        },
        {
          "text": "finish,",
          "start_ms": 9000,
          "end_ms": 9450
        },
        {
          "text": "and",
          "start_ms": 9500,
          "end_ms": 9950
        },
        {
          "text": "I",
          "start_ms": 10000,
          "end_ms": 10450
        },
        {
          "text": "want",
          "start_ms": 10500,
          "end_ms": 10950
        },
        {
          "text": "everyone",
          "start_ms": 11000,
          "end_ms": 11450
        },
        {
          "text": "to",
          "start_ms": 11500,
          "end_ms": 11950
        },
        {
          "text": "follow",
          "start_ms": 12000,
          "end_ms": 12450
        },
        {
          "text": "along",
          "start_ms": 12500,
          "end_ms": 12950
        },
        {
          "text": "in",
          "start_ms": 13000,
          "end_ms": 13450
        },
        {
          "text": "their",
          "start_ms": 13500,
          "end_ms": 13950
        },
        {
          "text": "own",
          "start_ms": 14000,
          "end_ms": 14450
        },
        {
          "text": "terminal",
          "start_ms": 14500,
          "end_ms": 14950
        },
        {
          "text": "so",
          "start_ms": 15000,
          "end_ms": 15450
        },
        {
          "text": "nothing",
          "start_ms": 15500,
          "end_ms": 15950
        },
        {
          "text": "is",
          "start_ms": 16000,
          "end_ms": 16450
        },
        {
          "text": "missed.",
          "start_ms": 16500,
          "end_ms": 16950
        }
      ]
    },
    {
      "id": "segment_002",
      "speaker_id": "speaker_2",
      "speaker_label": "Speaker 2",
      "start_ms": 18150,
      "end_ms": 19930,
      "text": "Sounds good to me.",
      "overlap": false,
      "timing_quality": "asr_word",
      "speaker_confidence": null,
      "words": [
        {
          "text": "Sounds",
          "start_ms": 18150,
          "end_ms": 18550
        },
        {
          "text": "good",
          "start_ms": 18610,
          "end_ms": 19010
        },
        {
          "text": "to",
          "start_ms": 19070,
          "end_ms": 19470
        },
        {
          "text": "me.",
          "start_ms": 19530,
          "end_ms": 19930
        }
      ]
    }
  ],
  "processing_options": {
    "diarization": true,
    "punctuation": true
  },
  "engine_revisions": {
    "asr": "parakeet-v1",
    "diarization": "offline-v1"
  },
  "warnings": []
}
