{
  "schema_version": 1,
  "transcript_id": "no-speech",
  "revision": 1,
  "status": "noSpeech",
  "created_at": "2026-09-03T12:05:00Z",
  "source": { "filename": "silence.wav", "duration_ms": 9000, "checksum": "sha256:silence" },
  "language": "und",
  "language_source": "unknown",
  "timestamp_unit": "milliseconds",
  "timestamp_origin": "source_start",
  "speakers": [],
  "segments": [],
  "processing_options": { "diarization": true },
  "engine_revisions": { "asr": "parakeet-v1" },
  "warnings": []
}
