{
  "schema_version": 1,
  "transcript_id": "long-turns",
  "revision": 1,
  "status": "complete",
  "created_at": "2026-09-03T12:06:00Z",
  "source": {
    "filename": "lecture.flac",
    "duration_ms": 120000,
    "checksum": "sha256:long"
  },
  "language": "en",
  "language_source": "detected",
  "timestamp_unit": "milliseconds",
  "timestamp_origin": "source_start",
  "speakers": [
    {
      "id": "speaker_1",
      "profile_id": null,
      "identity_assignment": "unmatched",
      "label_snapshot": "Speaker 1"
    }
  ],
  "segments": [
    {
      "id": "segment_001",
      "speaker_id": "speaker_1",
      "speaker_label": "Speaker 1",
      "start_ms": 0,
      "end_ms": 29500,
      "text": "This is a deliberately long speaking turn that remains a single canonical segment.",
      "overlap": false,
      "timing_quality": "segment_only",
      "speaker_confidence": null
    },
    {
      "id": "segment_002",
      "speaker_id": "speaker_1",
      "speaker_label": "Speaker 1",
      "start_ms": 30200,
      "end_ms": 59800,
      "text": "A later builder may split export cues without changing canonical chronology.",
      "overlap": false,
      "timing_quality": "segment_only",
      "speaker_confidence": null
    }
  ],
  "processing_options": {
    "maximum_segment_ms": 30000
  },
  "engine_revisions": {
    "asr": "parakeet-v1"
  },
  "warnings": []
}
