{
  "schema_version": 1,
  "transcript_id": "four-speakers",
  "revision": 1,
  "status": "complete",
  "created_at": "2026-09-03T12:02:00Z",
  "source": {
    "filename": "panel.wav",
    "duration_ms": 30000,
    "checksum": "sha256:four"
  },
  "language": "en",
  "language_source": "detected",
  "timestamp_unit": "milliseconds",
  "timestamp_origin": "source_start",
  "speakers": [
    {
      "id": "speaker_1",
      "profile_id": null,
      "identity_assignment": "unmatched",
      "label_snapshot": "Speaker 1"
    },
    {
      "id": "speaker_2",
      "profile_id": null,
      "identity_assignment": "unmatched",
      "label_snapshot": "Speaker 2"
    },
    {
      "id": "speaker_3",
      "profile_id": "profile-sam",
      "identity_assignment": "automatic",
      "label_snapshot": "Sam"
    },
    {
      "id": "speaker_4",
      "profile_id": null,
      "identity_assignment": "unmatched",
      "label_snapshot": "Speaker 4"
    }
  ],
  "segments": [
    {
      "id": "segment_001",
      "speaker_id": "speaker_1",
      "speaker_label": "Speaker 1",
      "start_ms": 0,
      "end_ms": 1000,
      "text": "One.",
      "overlap": false,
      "timing_quality": "segment_only",
      "speaker_confidence": null
    },
    {
      "id": "segment_002",
      "speaker_id": "speaker_2",
      "speaker_label": "Speaker 2",
      "start_ms": 1200,
      "end_ms": 2200,
      "text": "Two.",
      "overlap": false,
      "timing_quality": "segment_only",
      "speaker_confidence": null
    },
    {
      "id": "segment_003",
      "speaker_id": "speaker_3",
      "speaker_label": "Sam",
      "start_ms": 2400,
      "end_ms": 3400,
      "text": "Three.",
      "overlap": false,
      "timing_quality": "segment_only",
      "speaker_confidence": null
    },
    {
      "id": "segment_004",
      "speaker_id": "speaker_4",
      "speaker_label": "Speaker 4",
      "start_ms": 3600,
      "end_ms": 4600,
      "text": "Four.",
      "overlap": false,
      "timing_quality": "segment_only",
      "speaker_confidence": null
    }
  ],
  "processing_options": {
    "diarization": true
  },
  "engine_revisions": {
    "asr": "parakeet-v1"
  },
  "warnings": []
}
