{
  "schema_version": 1,
  "transcript_id": "two-speakers",
  "revision": 2,
  "status": "complete",
  "created_at": "2026-09-03T12:01:00Z",
  "source": {
    "filename": "interview.m4a",
    "duration_ms": 20000,
    "checksum": "sha256:two"
  },
  "language": "en",
  "language_source": "user_provided",
  "timestamp_unit": "milliseconds",
  "timestamp_origin": "source_start",
  "speakers": [
    {
      "id": "speaker_1",
      "profile_id": "profile-alex",
      "identity_assignment": "manual",
      "label_snapshot": "Alex"
    },
    {
      "id": "speaker_2",
      "profile_id": null,
      "identity_assignment": "unmatched",
      "label_snapshot": "Speaker 2"
    }
  ],
  "segments": [
    {
      "id": "segment_001",
      "speaker_id": "speaker_1",
      "speaker_label": "Alex",
      "start_ms": 500,
      "end_ms": 3100,
      "text": "Can we begin?",
      "overlap": false,
      "timing_quality": "asr_word",
      "speaker_confidence": null
    },
    {
      "id": "segment_002",
      "speaker_id": "speaker_2",
      "speaker_label": "Speaker 2",
      "start_ms": 3300,
      "end_ms": 6000,
      "text": "Yes, I have the notes.",
      "overlap": false,
      "timing_quality": "asr_word",
      "speaker_confidence": null
    }
  ],
  "processing_options": {
    "diarization": true
  },
  "engine_revisions": {
    "asr": "parakeet-v1",
    "diarization": "offline-v1"
  },
  "warnings": []
}
